project_id,project_name,description,start_date,deadline,status,manager_id,Team_Size,Project_Budget_USD,Estimated_Timeline_Months,Complexity_Score,Team_Experience_Level,Priority,Priority_Score,required_skillsets
PROJ-001,Summit AI Unlimited,"Introduce a robust automation system infrastructure for logistics applications to strengthen data governance. Following reactive programming best practices, the system includes advanced security protocols, addresses user adoption strategies, and optimizes for outcomes like better user engagement.",2024-02-04,2024-09-01,Completed,EMP-107,5,4839,7,7,3.6,Low,1,Microservices; HTML; Linux; GraphQL; Pandas; Leadership; PyTorch; Flask
PROJ-002,Acceleration Digital Plus,"Pioneer a comprehensive digital platform for the travel hospitality sector designed to boost productivity metrics. Leveraging event-driven design patterns, this initiative will deliver augmented reality features while addressing documentation standards, ultimately achieving better resource utilization.",2024-01-19,2024-12-14,On Hold,EMP-106,5,8940,11,10,3.2,High,3,PHP; Microservices; Agile; Go; Azure; HTML
PROJ-003,Vanguard Automation Elite,"Launch an innovative compliance tool targeting cybersecurity clients with the primary goal to improve user experience. Built on API-first methodology principles, the solution incorporates comprehensive reporting suite and navigates regulatory compliance requirements to deliver measurable outcomes including increased system reliability.",2024-01-11,2024-07-09,On Hold,EMP-106,4,6381,6,6,3.7,Low,1,Linux; Bash; Node.js; C++; Redis; Project Management; Pandas
PROJ-004,Transformation Analytics Core,"Establish an enterprise-grade real-time dashboard for the government market focused on strengthen data governance. Employing component-based architecture strategy, the implementation features automated workflow engine, manages cross-team coordination, and targets key performance indicators such as enhanced data insights.",2024-03-23,2024-11-18,In Progress,EMP-102,10,6933,8,7,2.0,Medium,2,Bash; Spring; Azure; Scrum; HTML; PyTorch; AWS
PROJ-005,Revolution Data Next,"Institute an enterprise-grade monitoring solution for the media entertainment market focused on optimize supply chain. Employing infrastructure as code strategy, the implementation features mobile-optimized design, manages disaster recovery planning, and targets key performance indicators such as improved team productivity.",2024-01-13,2024-07-11,Completed,EMP-109,5,6642,6,7,3.7,High,3,TensorFlow; Spring; Git; Data Analysis; Ruby; Vue.js
PROJ-006,Genesis Analytics Edge,"Deploy a cutting-edge AI-powered tool solution in the pharmaceutical domain aimed at boost productivity metrics. Based on component-based architecture framework, this endeavor delivers blockchain verification, mitigates quality assurance processes, and drives business value through increased customer retention.",2024-01-15,2024-05-14,In Progress,EMP-113,5,3972,4,3,4.5,Low,1,Redis; CSS; C#; Ruby; AWS; CI/CD; Machine Learning; Linux
PROJ-007,Pinnacle Optimization X,"Deploy an enterprise-grade software solution for the retail operations market focused on optimize resource allocation. Employing infrastructure as code strategy, the implementation features natural language processing, manages vendor management, and targets key performance indicators such as improved team productivity.",2024-03-27,2024-07-25,In Progress,EMP-116,5,3960,4,4,4.3,Low,1,MySQL; CSS; Linux; Microservices; R; Tableau; Machine Learning; Kubernetes
PROJ-008,Vanguard Transformation 360,"Create an enterprise-grade integration hub for the gaming market focused on expand service offerings. Employing DevOps implementation strategy, the implementation features automated workflow engine, manages change management, and targets key performance indicators such as faster time-to-market.",2024-02-15,2024-11-11,In Progress,EMP-116,12,3594,9,7,2.5,Low,1,Microservices; AWS; SQL; Java; Linux; JavaScript; Docker
PROJ-009,Apex Digital Plus,"Develop a robust monitoring solution infrastructure for telecommunications applications to enable real-time insights. Following component-based architecture best practices, the system includes computer vision integration, addresses budget allocation limitations, and optimizes for outcomes like better resource utilization.",2024-03-22,2024-11-17,In Progress,EMP-111,5,4260,8,6,4.1,Medium,2,C#; MySQL; SQL; HTML
PROJ-010,Vertex AI One,"Formulate a comprehensive data analytics for the healthcare sector designed to improve user experience. Leveraging component-based architecture, this initiative will deliver scalable infrastructure while addressing security vulnerability mitigation, ultimately achieving enhanced user satisfaction.",2024-02-17,2024-09-14,On Hold,EMP-103,10,3039,7,6,2.7,Medium,2,CSS; Ruby; Microservices; Jenkins; Redis; Vue.js; C++; Django
PROJ-011,Pinnacle Program Pro,"Construct an innovative compliance tool targeting pharmaceutical clients with the primary goal to improve data security measures. Built on reactive programming principles, the solution incorporates natural language processing and navigates vendor management to deliver measurable outcomes including improved security posture.",2024-03-21,2024-06-19,Completed,EMP-101,12,3603,3,3,2.6,Low,1,Pandas; SQL; Angular; Redis; C#; Vue.js; R
PROJ-012,Catalyst Initiative Unlimited,"Deploy a robust reporting system infrastructure for energy sector applications to reduce operational costs. Following data mesh architecture best practices, the system includes voice-enabled interactions, addresses scalability challenges, and optimizes for outcomes like enhanced data insights.",2024-03-18,2024-10-14,Completed,EMP-116,5,5472,7,5,3.4,Low,1,Express.js; Flask; Leadership; Communication
PROJ-013,Quantum Cloud Edge,"Construct a cutting-edge digital platform solution in the insurance domain aimed at improve user experience. Based on DevOps implementation framework, this endeavor delivers natural language processing, mitigates vendor management, and drives business value through enhanced compliance status.",2024-02-29,2024-09-26,In Progress,EMP-119,15,2418,7,5,2.5,Medium,2,Rust; Pandas; C++; Scrum; C#; Linux; Project Management; Flask
PROJ-014,Frontier Digital Next,"Implement an innovative cloud infrastructure targeting automotive industry clients with the primary goal to strengthen compliance protocols. Built on serverless computing framework principles, the solution incorporates voice-enabled interactions and navigates change management to deliver measurable outcomes including better resource utilization.",2024-01-01,2025-01-25,In Progress,EMP-115,4,7683,13,8,5.0,High,3,TensorFlow; CSS; Redis; AWS; GraphQL; PostgreSQL
PROJ-015,Apex Modernization Max,"Pioneer an enterprise-grade mobile application for the automotive industry market focused on strengthen data governance. Employing infrastructure as code strategy, the implementation features augmented reality features, manages quality assurance processes, and targets key performance indicators such as improved team productivity.",2024-02-08,2025-01-03,Completed,EMP-101,8,7083,11,8,3.1,High,3,C++; Communication; Data Analysis; Agile; Scrum; Azure; REST API; R
PROJ-016,Evolution Framework Advanced,"Build a scalable reporting system platform serving manufacturing organizations to enhance customer engagement. Utilizing functional programming paradigm methodology, this project introduces edge computing capabilities while overcoming budget allocation limitations and demonstrating success through increased system reliability.",2024-01-06,2024-06-04,On Hold,EMP-112,5,2886,5,3,4.0,Low,1,CSS; Jenkins; Linux; Project Management; PyTorch; JavaScript; Leadership; Node.js
PROJ-017,Evolution Data Pro,"Build a next-generation compliance tool framework for the automotive industry industry to enhance customer engagement. Using progressive enhancement techniques, the architecture provides advanced security protocols, handles change management, and improves business metrics including increased automation rate.",2024-03-20,2025-04-14,On Hold,EMP-102,3,8229,13,8,3.1,High,3,R; Agile; Docker; C++; Ruby; GraphQL; Kubernetes; JavaScript
PROJ-018,Apex Transformation Plus,"Engineer an innovative digital platform targeting energy sector clients with the primary goal to improve product quality. Built on containerization strategy principles, the solution incorporates automated workflow engine and navigates scalability challenges to deliver measurable outcomes including improved scalability.",2024-01-18,2024-12-13,Completed,EMP-106,4,3507,11,10,3.3,High,3,Tableau; React; CI/CD; Problem Solving
PROJ-019,Synergy Intelligence 360,"Formulate an intelligent data analytics ecosystem serving logistics needs to enable real-time insights. Through infrastructure as code implementation, the platform offers voice-enabled interactions, resolves technology stack modernization, and enhances operational efficiency via reduced maintenance overhead.",2024-01-07,2024-05-06,In Progress,EMP-112,3,3771,4,3,3.4,Low,1,React; Leadership; JavaScript; AWS; Rust; Agile; Vue.js; Go
PROJ-020,Odyssey Optimization Prime,"Construct a next-generation progressive web app framework for the government industry to improve data security measures. Using DevOps implementation techniques, the architecture provides real-time analytics dashboard, handles legacy system integration, and improves business metrics including better resource utilization.",2024-03-02,2024-09-28,In Progress,EMP-103,10,2268,7,6,3.6,High,3,Microservices; GCP; React; Redis; Express.js; Project Management; Kubernetes; SQL
PROJ-021,Horizon Enterprise Enterprise,"Construct an intelligent automation system ecosystem serving travel hospitality needs to improve data security measures. Through continuous delivery pipeline implementation, the platform offers intuitive user experience, resolves data migration complexities, and enhances operational efficiency via enhanced user satisfaction.",2024-01-02,2024-09-28,Not Started,EMP-108,6,4212,9,7,4.0,Medium,2,Rust; Spring; Go; Express.js
PROJ-022,Synergy Modernization One,"Implement an enterprise-grade automation system for the cybersecurity market focused on enhance customer engagement. Employing DevOps implementation strategy, the implementation features automated workflow engine, manages data privacy concerns, and targets key performance indicators such as better decision support.",2024-01-20,2024-10-16,In Progress,EMP-103,10,3105,9,7,2.6,Medium,2,Pandas; GraphQL; REST API; Data Analysis
PROJ-023,Nexus Optimization Premium,"Initiate an enterprise-grade reporting system for the cybersecurity market focused on boost productivity metrics. Employing DevOps implementation strategy, the implementation features predictive analytics capabilities, manages cross-team coordination, and targets key performance indicators such as enhanced data insights.",2024-01-14,2024-08-11,On Hold,EMP-114,3,2259,7,6,4.7,Medium,2,MongoDB; Communication; Tableau; Rust; PyTorch; GCP
PROJ-024,Catalyst Optimization Unlimited,"Construct an intelligent security framework ecosystem serving healthcare needs to facilitate global expansion. Through zero-trust security model implementation, the platform offers edge computing capabilities, resolves user adoption strategies, and enhances operational efficiency via increased automation rate.",2024-03-10,2024-11-05,In Progress,EMP-101,5,3570,8,6,3.0,Low,1,AWS; SQL; Express.js; MySQL; Git; Agile; TensorFlow
PROJ-025,Momentum AI Enterprise,"Construct a scalable machine learning model platform serving logistics organizations to automate manual processes. Utilizing cloud-native development methodology, this project introduces distributed ledger technology while overcoming scalability challenges and demonstrating success through increased automation rate.",2024-03-05,2024-09-01,On Hold,EMP-119,8,2916,6,6,4.3,Medium,2,Bash; Vue.js; Communication; MySQL; Agile; C#
PROJ-026,Acceleration Optimization Advanced,"Roll out a comprehensive enterprise system for the non-profit sector designed to increase market competitiveness. Leveraging cloud-native development, this initiative will deliver mobile-optimized design while addressing data privacy concerns, ultimately achieving better user engagement.",2024-01-07,2024-06-05,On Hold,EMP-117,5,5283,5,6,4.4,High,3,Redis; Django; NumPy; Agile; Ruby
PROJ-027,Genesis Digital Core,"Establish an enterprise-grade microservices architecture for the retail operations market focused on streamline operational workflows. Employing agile development practices strategy, the implementation features intuitive user experience, manages data migration complexities, and targets key performance indicators such as improved team productivity.",2024-01-30,2024-06-28,Completed,EMP-109,4,3663,5,6,4.2,High,3,Leadership; Scrum; CI/CD; REST API; GraphQL
PROJ-028,Vanguard Enterprise Edge,"Construct a next-generation automation system framework for the non-profit industry to facilitate global expansion. Using domain-driven design principles techniques, the architecture provides mobile-optimized design, handles integration complexity, and improves business metrics including enhanced data insights.",2024-01-29,2024-09-25,Completed,EMP-113,5,8895,8,7,2.2,Medium,2,Data Analysis; Linux; R; Pandas; Leadership; Go; Swift
PROJ-029,Vanguard Digital Prime,"Formulate an intelligent software solution ecosystem serving gaming needs to expand service offerings. Through API-first methodology implementation, the platform offers real-time analytics dashboard, resolves vendor management, and enhances operational efficiency via reduced error rates.",2024-03-09,2024-09-05,In Progress,EMP-112,4,4476,6,7,4.0,Medium,2,AWS; Node.js; PostgreSQL; MySQL; JavaScript
PROJ-030,Innovation Program Plus,"Pioneer a robust monitoring solution infrastructure for media entertainment applications to modernize legacy infrastructure. Following component-based architecture best practices, the system includes computer vision integration, addresses technology stack modernization, and optimizes for outcomes like higher system availability.",2024-02-12,2024-08-10,Not Started,EMP-112,5,4017,6,5,3.5,Low,1,Communication; Git; Azure; Flask; HTML; Bash; Swift; Ruby
PROJ-031,Frontier Solution Unlimited,"Build a comprehensive software solution for the financial services sector designed to enable real-time insights. Leveraging API-first methodology, this initiative will deliver comprehensive reporting suite while addressing performance optimization, ultimately achieving better data accuracy.",2024-02-19,2024-08-17,On Hold,EMP-101,3,6429,6,5,4.0,Low,1,Communication; Vue.js; JavaScript; React; C++; Bash; MySQL
PROJ-032,Quantum Modernization Ultimate,"Develop a cutting-edge digital platform solution in the non-profit domain aimed at optimize supply chain. Based on responsive design system framework, this endeavor delivers real-time analytics dashboard, mitigates legacy system integration, and drives business value through enhanced data insights.",2024-03-23,2025-04-17,In Progress,EMP-109,6,8040,13,9,3.5,High,3,SQL; Express.js; Project Management; Swift; REST API; Jenkins
PROJ-033,Genesis System Edge,"Create a cutting-edge cloud infrastructure solution in the government domain aimed at improve data security measures. Based on DevOps implementation framework, this endeavor delivers intuitive user experience, mitigates disaster recovery planning, and drives business value through enhanced data insights.",2024-02-11,2024-08-09,On Hold,EMP-113,3,1755,6,5,3.9,High,3,Kubernetes; Microservices; TensorFlow; REST API; JavaScript; SQL
PROJ-034,Innovation Solution Pro,"Institute an intelligent reporting system ecosystem serving education technology needs to expand service offerings. Through domain-driven design principles implementation, the platform offers seamless third-party integrations, resolves regulatory compliance requirements, and enhances operational efficiency via reduced operational costs.",2024-01-30,2024-07-28,In Progress,EMP-107,15,2334,6,5,2.5,Medium,2,Java; JavaScript; Flask; Linux; AWS; CSS; Spring; Azure
PROJ-035,Innovation Cloud Plus,"Build an enterprise-grade security framework for the agricultural technology market focused on boost productivity metrics. Employing machine learning pipelines strategy, the implementation features responsive user interface, manages change management, and targets key performance indicators such as enhanced user satisfaction.",2024-01-07,2024-09-03,Not Started,EMP-101,4,8838,8,7,3.1,Low,1,Python; Communication; Django; TensorFlow; Docker; Microservices; R; Java
PROJ-036,Apex Data Premium,"Engineer a scalable monitoring solution platform serving gaming organizations to enhance customer engagement. Utilizing serverless computing framework methodology, this project introduces AI-assisted functionality while overcoming legacy system integration and demonstrating success through improved security posture.",2024-03-22,2024-08-19,In Progress,EMP-113,5,7161,5,6,4.4,High,3,Docker; REST API; AWS; Angular; Data Analysis; PostgreSQL; GraphQL
PROJ-037,Apex AI Prime,"Construct a comprehensive monitoring solution for the media entertainment sector designed to improve user experience. Leveraging API-first methodology, this initiative will deliver seamless third-party integrations while addressing change management, ultimately achieving improved scalability.",2024-03-22,2025-02-15,Completed,EMP-119,8,8484,11,9,2.7,Low,1,PostgreSQL; Django; Node.js; HTML; Project Management
PROJ-038,Genesis System One,"Develop an intelligent IoT ecosystem ecosystem serving automotive industry needs to enhance scalability capabilities. Through DevOps implementation implementation, the platform offers blockchain verification, resolves quality assurance processes, and enhances operational efficiency via reduced maintenance overhead.",2024-01-24,2024-10-20,In Progress,EMP-106,2,6222,9,8,4.9,Medium,2,Docker; Communication; PyTorch; CSS; TensorFlow; Project Management; Azure; Microservices
PROJ-039,Summit Integration Edge,"Build a robust enterprise system infrastructure for insurance applications to improve data security measures. Following zero-trust security model best practices, the system includes advanced security protocols, addresses data privacy concerns, and optimizes for outcomes like enhanced compliance status.",2024-01-19,2024-07-17,Completed,EMP-110,4,5841,6,5,3.7,Low,1,Data Analysis; Rust; PyTorch; Kubernetes
PROJ-040,Frontier Optimization Enterprise,"Create an intelligent mobile application ecosystem serving e-commerce needs to reduce operational costs. Through responsive design system implementation, the platform offers natural language processing, resolves quality assurance processes, and enhances operational efficiency via reduced error rates.",2024-02-21,2024-06-20,Completed,EMP-108,5,2349,4,4,4.7,Low,1,Angular; Kubernetes; Node.js; SQL
PROJ-041,Synergy Cloud One,"Construct a scalable digital platform platform serving retail operations organizations to enable real-time insights. Utilizing zero-trust security model methodology, this project introduces seamless third-party integrations while overcoming quality assurance processes and demonstrating success through faster time-to-market.",2024-02-24,2024-08-22,Completed,EMP-106,3,4884,6,6,4.2,High,3,Python; C#; C++; Ruby; PyTorch
PROJ-042,Pinnacle Digital Unlimited,"Pioneer a next-generation mobile application framework for the e-commerce industry to reduce operational costs. Using responsive design system techniques, the architecture provides mobile-optimized design, handles scalability challenges, and improves business metrics including better resource utilization.",2024-03-01,2024-10-27,In Progress,EMP-116,6,7755,8,6,4.6,High,3,React; Kubernetes; CSS; Machine Learning; Node.js; PHP
PROJ-043,Evolution AI Ultimate,"Institute an intelligent cloud infrastructure ecosystem serving logistics needs to strengthen compliance protocols. Through microservices architecture implementation, the platform offers voice-enabled interactions, resolves user adoption strategies, and enhances operational efficiency via better user engagement.",2024-02-09,2025-03-05,In Progress,EMP-113,6,9714,13,8,3.6,High,3,Tableau; Microservices; Azure; Leadership; MongoDB; Vue.js
PROJ-044,Acceleration Digital Core,"Deploy a robust microservices architecture infrastructure for cybersecurity applications to increase market competitiveness. Following component-based architecture best practices, the system includes AI-assisted functionality, addresses aggressive timeline constraints, and optimizes for outcomes like reduced maintenance overhead.",2024-02-03,2024-09-30,On Hold,EMP-106,4,10575,8,7,4.3,Medium,2,SQL; Scrum; Spring; C++; Express.js; Flask; Jenkins
PROJ-045,Quantum Integration Advanced,"Engineer a scalable progressive web app platform serving travel hospitality organizations to accelerate decision-making processes. Utilizing machine learning pipelines methodology, this project introduces intuitive user experience while overcoming documentation standards and demonstrating success through reduced error rates.",2024-02-13,2024-07-12,On Hold,EMP-119,8,7305,5,5,3.3,High,3,MongoDB; Docker; GCP; Redis; Tableau; JavaScript; CSS; R
PROJ-046,Apex Integration Unlimited,"Deploy a scalable enterprise system platform serving agricultural technology organizations to enhance scalability capabilities. Utilizing API-first methodology methodology, this project introduces predictive analytics capabilities while overcoming technical debt resolution and demonstrating success through increased customer retention.",2024-02-16,2025-01-11,On Hold,EMP-109,12,6327,11,10,2.4,High,3,Git; Microservices; Java; CSS; REST API; TensorFlow; Swift
PROJ-047,Frontier Program Plus,"Construct an innovative compliance tool targeting agricultural technology clients with the primary goal to optimize supply chain. Built on cloud-native development principles, the solution incorporates blockchain verification and navigates quality assurance processes to deliver measurable outcomes including better user engagement.",2024-01-07,2024-11-02,On Hold,EMP-110,4,4743,10,8,3.9,Medium,2,Spring; React; Swift; HTML; C++
PROJ-048,Evolution Modernization Elite,"Initiate an enterprise-grade real-time dashboard for the manufacturing market focused on streamline operational workflows. Employing event-driven design patterns strategy, the implementation features mobile-optimized design, manages technical debt resolution, and targets key performance indicators such as enhanced data insights.",2024-02-25,2025-01-20,Completed,EMP-102,4,8196,11,9,4.6,High,3,C#; Git; Kubernetes; PostgreSQL; C++; TensorFlow; AWS
PROJ-049,Momentum Modernization Unlimited,"Develop a robust security framework infrastructure for manufacturing applications to strengthen compliance protocols. Following responsive design system best practices, the system includes seamless third-party integrations, addresses data migration complexities, and optimizes for outcomes like better data accuracy.",2024-01-22,2024-08-19,Completed,EMP-111,8,7803,7,7,4.3,Medium,2,Communication; C#; GraphQL; Express.js; Data Analysis; Spring; CI/CD
PROJ-050,Vertex Program Next,"Pioneer an innovative cloud infrastructure targeting automotive industry clients with the primary goal to automate manual processes. Built on test-driven development principles, the solution incorporates seamless third-party integrations and navigates security vulnerability mitigation to deliver measurable outcomes including enhanced user satisfaction.",2024-03-09,2024-07-07,In Progress,EMP-113,5,3402,4,4,4.4,Low,1,Redis; Tableau; TensorFlow; Flask; Node.js; Angular
PROJ-051,Genesis Platform Advanced,"Construct a scalable data analytics platform serving media entertainment organizations to optimize supply chain. Utilizing responsive design system methodology, this project introduces natural language processing while overcoming technical debt resolution and demonstrating success through reduced maintenance overhead.",2024-01-21,2024-08-18,On Hold,EMP-103,5,5748,7,7,3.6,Low,1,CI/CD; MySQL; Data Analysis; Microservices; Django; TensorFlow; Project Management
PROJ-052,Catalyst Intelligence Core,"Formulate an innovative progressive web app targeting financial services clients with the primary goal to increase market competitiveness. Built on agile development practices principles, the solution incorporates mobile-optimized design and navigates performance optimization to deliver measurable outcomes including increased system reliability.",2024-03-09,2024-06-07,In Progress,EMP-101,3,2544,3,4,4.4,High,3,CI/CD; Python; SQL; Spring; Redis; Machine Learning; Leadership; Linux
PROJ-053,Frontier Integration Premium,"Institute an intelligent cloud infrastructure ecosystem serving insurance needs to enhance scalability capabilities. Through reactive programming implementation, the platform offers AI-assisted functionality, resolves disaster recovery planning, and enhances operational efficiency via reduced maintenance overhead.",2024-03-13,2024-09-09,Completed,EMP-106,3,7503,6,6,4.4,Medium,2,Java; R; TensorFlow; Angular; CSS; Git
PROJ-054,Genesis Automation Elite,"Build a robust mobile application infrastructure for media entertainment applications to accelerate decision-making processes. Following DevOps implementation best practices, the system includes predictive analytics capabilities, addresses data migration complexities, and optimizes for outcomes like higher system availability.",2024-02-14,2024-09-11,On Hold,EMP-105,3,9621,7,7,3.1,High,3,Jenkins; MySQL; Data Analysis; PHP; Spring; Java; AWS; Swift
