project_id,project_name,description,start_date,deadline,status,manager_id,Team_Size,Project_Budget_USD,Estimated_Timeline_Months,Complexity_Score,Team_Experience_Level,Priority,Priority_Score,required_skillsets
PROJ-220,Quantum Cloud Elite,"Deploy an enterprise-grade integration hub for the financial services market focused on drive innovation initiatives. Employing API-first methodology strategy, the implementation features predictive analytics capabilities, manages legacy system integration, and targets key performance indicators such as better resource utilization.",2024-01-21,2024-11-16,Not Started,EMP-113,8,6729,10,10,3.5,Medium,2,GraphQL; GCP; Problem Solving; Bash; Node.js; Ruby
PROJ-221,Apex Analytics Advanced,"Implement an enterprise-grade automation system for the travel hospitality market focused on improve data security measures. Employing API-first methodology strategy, the implementation features mobile-optimized design, manages integration complexity, and targets key performance indicators such as increased system reliability.",2024-03-07,2024-06-05,Not Started,EMP-100,5,4974,3,3,4.3,Low,1,AWS; SQL; Docker; Tableau; Problem Solving; Data Analysis
PROJ-222,Genesis System Plus,"Initiate a comprehensive security framework for the telecommunications sector designed to enhance scalability capabilities. Leveraging machine learning pipelines, this initiative will deliver responsive user interface while addressing disaster recovery planning, ultimately achieving better resource utilization.",2024-01-07,2025-01-31,Completed,EMP-107,12,9603,13,10,2.9,High,3,Machine Learning; Angular; Rust; React; MongoDB; Java; Express.js; Flask
PROJ-223,Vanguard Optimization Elite,"Roll out a comprehensive real-time dashboard for the agricultural technology sector designed to accelerate decision-making processes. Leveraging DevOps implementation, this initiative will deliver federated learning system while addressing legacy system integration, ultimately achieving reduced maintenance overhead.",2024-03-30,2025-03-25,Completed,EMP-118,10,3630,12,10,2.3,Medium,2,Ruby; MySQL; Problem Solving; Node.js
PROJ-224,Genesis Initiative Elite,"Introduce an innovative blockchain network targeting logistics clients with the primary goal to enhance customer engagement. Built on zero-trust security model principles, the solution incorporates natural language processing and navigates disaster recovery planning to deliver measurable outcomes including increased system reliability.",2024-02-16,2025-05-11,Completed,EMP-111,15,6762,15,10,2.4,Medium,2,Git; Angular; Machine Learning; PostgreSQL; GraphQL; CSS
PROJ-225,Synergy Transformation Advanced,"Build an intelligent security framework ecosystem serving gaming needs to enhance customer engagement. Through functional programming paradigm implementation, the platform offers voice-enabled interactions, resolves vendor management, and enhances operational efficiency via reduced operational costs.",2024-01-22,2024-06-20,On Hold,EMP-104,5,3666,5,3,3.9,Medium,2,MySQL; Java; React; Express.js; Data Analysis
PROJ-226,Vanguard System 360,"Construct an innovative reporting system targeting energy sector clients with the primary goal to optimize supply chain. Built on data mesh architecture principles, the solution incorporates edge computing capabilities and navigates technical debt resolution to deliver measurable outcomes including faster time-to-market.",2024-02-03,2024-08-01,On Hold,EMP-103,6,5496,6,6,3.8,Medium,2,Linux; CI/CD; C#; Communication; Angular; PostgreSQL; Vue.js
PROJ-227,Evolution Initiative Max,"Formulate a cutting-edge API framework solution in the travel hospitality domain aimed at increase market competitiveness. Based on test-driven development framework, this endeavor delivers blockchain verification, mitigates disaster recovery planning, and drives business value through improved system performance.",2024-02-01,2024-09-28,Not Started,EMP-118,8,7611,8,7,3.5,Low,1,Scrum; Azure; React; Go; Django; PostgreSQL
PROJ-228,Quantum AI 360,"Construct a scalable AI-powered tool platform serving travel hospitality organizations to improve data security measures. Utilizing containerization strategy methodology, this project introduces responsive user interface while overcoming regulatory compliance requirements and demonstrating success through faster time-to-market.",2024-01-09,2024-07-07,Completed,EMP-108,4,2574,6,4,4.4,High,3,Redis; Project Management; Agile; Problem Solving; Leadership; Flask
PROJ-229,Synergy Platform Prime,"Institute a cutting-edge security framework solution in the financial services domain aimed at boost productivity metrics. Based on agile development practices framework, this endeavor delivers distributed ledger technology, mitigates budget allocation limitations, and drives business value through improved security posture.",2024-03-09,2025-02-02,Not Started,EMP-105,4,6009,11,9,3.9,High,3,Data Analysis; C++; GCP; JavaScript; SQL; Bash; C#; Machine Learning
PROJ-230,Apex Analytics X,"Engineer a next-generation data analytics framework for the healthcare industry to strengthen compliance protocols. Using agile development practices techniques, the architecture provides federated learning system, handles vendor management, and improves business metrics including enhanced user satisfaction.",2024-01-31,2024-10-27,Completed,EMP-117,10,4668,9,8,2.7,High,3,Redis; Vue.js; Bash; Go
PROJ-231,Revolution System Premium,"Create a robust digital platform infrastructure for retail operations applications to improve user experience. Following DevOps implementation best practices, the system includes voice-enabled interactions, addresses change management, and optimizes for outcomes like increased processing speed.",2024-01-14,2024-09-10,In Progress,EMP-113,2,5208,8,6,3.6,Medium,2,PyTorch; Express.js; JavaScript; Go; AWS; Docker; Project Management; C#
PROJ-232,Quantum Intelligence Edge,"Introduce a robust automation system infrastructure for non-profit applications to streamline operational workflows. Following cloud-native development best practices, the system includes comprehensive reporting suite, addresses change management, and optimizes for outcomes like better resource utilization.",2024-03-11,2024-08-08,Completed,EMP-119,3,4380,5,5,3.8,Medium,2,TensorFlow; Scrum; Go; PyTorch; Machine Learning
PROJ-233,Genesis Initiative Enterprise,"Deploy a cutting-edge blockchain network solution in the government domain aimed at modernize legacy infrastructure. Based on cloud-native development framework, this endeavor delivers mobile-optimized design, mitigates data privacy concerns, and drives business value through improved system performance.",2024-02-03,2024-04-03,On Hold,EMP-111,2,2172,2,3,4.2,Low,1,Agile; GraphQL; CSS; PyTorch; GCP; Python
PROJ-234,Evolution Optimization Elite,"Introduce a cutting-edge integration hub solution in the education technology domain aimed at enable real-time insights. Based on DevOps implementation framework, this endeavor delivers quantum-resistant cryptography, mitigates cross-team coordination, and drives business value through increased automation rate.",2024-03-10,2024-11-05,In Progress,EMP-107,3,3294,8,6,4.3,High,3,Kubernetes; Pandas; MySQL; PyTorch; PostgreSQL; Bash
PROJ-235,Acceleration Program Core,"Design an intelligent reporting system ecosystem serving non-profit needs to increase market competitiveness. Through API-first methodology implementation, the platform offers predictive analytics capabilities, resolves change management, and enhances operational efficiency via better data accuracy.",2024-01-27,2024-12-22,Not Started,EMP-113,5,9099,11,9,4.5,High,3,REST API; Project Management; Spring; Jenkins; Bash
PROJ-236,Evolution Cloud Elite,"Construct an intelligent monitoring solution ecosystem serving manufacturing needs to reduce operational costs. Through test-driven development implementation, the platform offers advanced security protocols, resolves legacy system integration, and enhances operational efficiency via enhanced compliance status.",2024-02-08,2024-07-07,In Progress,EMP-111,10,5535,5,3,3.1,High,3,PyTorch; Angular; AWS; Tableau; REST API; Project Management
PROJ-237,Quantum Intelligence Enterprise,"Create an enterprise-grade mobile application for the telecommunications market focused on streamline operational workflows. Employing data mesh architecture strategy, the implementation features federated learning system, manages vendor management, and targets key performance indicators such as better user engagement.",2024-01-08,2024-05-07,On Hold,EMP-114,10,3042,4,3,3.4,Medium,2,Bash; CI/CD; Communication; PostgreSQL; Data Analysis
PROJ-238,Horizon Solution Ultimate,"Design a next-generation compliance tool framework for the cybersecurity industry to enhance scalability capabilities. Using infrastructure as code techniques, the architecture provides scalable infrastructure, handles data privacy concerns, and improves business metrics including improved team productivity.",2024-01-14,2024-07-12,Not Started,EMP-101,10,3228,6,6,4.0,Low,1,Tableau; Jenkins; MongoDB; Project Management; Vue.js
PROJ-239,Horizon Automation Prime,"Engineer a next-generation real-time dashboard framework for the education technology industry to increase market competitiveness. Using agile development practices techniques, the architecture provides seamless third-party integrations, handles aggressive timeline constraints, and improves business metrics including better decision support.",2024-01-09,2024-04-08,Not Started,EMP-116,8,2802,3,4,2.7,Medium,2,MongoDB; R; Problem Solving; React; Microservices; GCP; Redis
PROJ-240,Evolution Solution Next,"Construct a comprehensive microservices architecture for the real estate sector designed to strengthen data governance. Leveraging machine learning pipelines, this initiative will deliver federated learning system while addressing quality assurance processes, ultimately achieving enhanced data insights.",2024-02-29,2024-09-26,On Hold,EMP-105,12,7035,7,7,2.0,Medium,2,Leadership; Python; PHP; Communication; SQL; AWS; Bash
PROJ-241,Evolution Program Ultimate,"Implement an intelligent monitoring solution ecosystem serving real estate needs to drive innovation initiatives. Through cloud-native development implementation, the platform offers intuitive user experience, resolves security vulnerability mitigation, and enhances operational efficiency via better decision support.",2024-01-03,2024-09-29,Completed,EMP-115,15,3525,9,9,2.3,High,3,Pandas; Microservices; GraphQL; React; Linux; Ruby
PROJ-242,Synergy Analytics Ultimate,"Implement a scalable compliance tool platform serving logistics organizations to automate manual processes. Utilizing progressive enhancement methodology, this project introduces seamless third-party integrations while overcoming change management and demonstrating success through increased processing speed.",2024-01-17,2024-12-12,Completed,EMP-114,4,7335,11,8,3.0,High,3,Spring; Python; Git; HTML; Rust; TensorFlow; Ruby; Redis
PROJ-243,Vertex System 360,"Institute a cutting-edge digital platform solution in the telecommunications domain aimed at automate manual processes. Based on machine learning pipelines framework, this endeavor delivers intuitive user experience, mitigates technology stack modernization, and drives business value through reduced operational costs.",2024-03-21,2024-09-17,On Hold,EMP-109,6,3684,6,7,3.9,Medium,2,JavaScript; Bash; Kubernetes; SQL; Vue.js
PROJ-244,Vanguard Initiative Premium,"Roll out an intelligent enterprise system ecosystem serving government needs to improve user experience. Through reactive programming implementation, the platform offers federated learning system, resolves aggressive timeline constraints, and enhances operational efficiency via reduced maintenance overhead.",2024-02-09,2024-12-05,In Progress,EMP-117,2,7533,10,8,3.8,Low,1,PostgreSQL; Docker; Spring; REST API; Communication
PROJ-245,Quantum Cloud Pro,"Launch an innovative software solution targeting agricultural technology clients with the primary goal to strengthen compliance protocols. Built on domain-driven design principles principles, the solution incorporates natural language processing and navigates security vulnerability mitigation to deliver measurable outcomes including higher system availability.",2024-03-30,2024-09-26,On Hold,EMP-108,5,7695,6,7,3.5,High,3,GraphQL; MongoDB; Django; Node.js; Spring
PROJ-246,Apex Platform Next,"Pioneer a next-generation security framework framework for the non-profit industry to streamline operational workflows. Using data mesh architecture techniques, the architecture provides computer vision integration, handles technical debt resolution, and improves business metrics including improved security posture.",2024-02-11,2024-09-08,Completed,EMP-110,12,2487,7,7,2.1,Medium,2,Linux; Ruby; Kubernetes; Node.js; Communication; Microservices; Leadership
PROJ-247,Summit AI Enterprise,"Construct a scalable AI-powered tool platform serving healthcare organizations to reduce operational costs. Utilizing API-first methodology methodology, this project introduces automated workflow engine while overcoming integration complexity and demonstrating success through enhanced user satisfaction.",2024-03-24,2024-07-22,Not Started,EMP-114,4,5034,4,5,4.5,High,3,NumPy; Java; Data Analysis; Vue.js; Scrum; JavaScript; Tableau; Pandas
PROJ-248,Frontier Solution Enterprise,"Create a scalable real-time dashboard platform serving telecommunications organizations to reduce operational costs. Utilizing domain-driven design principles methodology, this project introduces federated learning system while overcoming disaster recovery planning and demonstrating success through increased system reliability.",2024-02-16,2024-08-14,Completed,EMP-109,8,4104,6,7,3.2,High,3,Node.js; CSS; Angular; MongoDB; Kubernetes; C++; HTML; Vue.js
PROJ-249,Vanguard Modernization Ultimate,"Initiate a next-generation API framework framework for the real estate industry to optimize resource allocation. Using responsive design system techniques, the architecture provides distributed ledger technology, handles performance optimization, and improves business metrics including better resource utilization.",2024-03-25,2024-08-22,In Progress,EMP-101,5,2667,5,5,4.0,Low,1,PyTorch; MongoDB; Jenkins; JavaScript; Leadership; Communication
PROJ-250,Pinnacle Modernization Edge,"Establish a cutting-edge integration hub solution in the healthcare domain aimed at accelerate decision-making processes. Based on machine learning pipelines framework, this endeavor delivers edge computing capabilities, mitigates performance optimization, and drives business value through improved team productivity.",2024-03-10,2025-05-04,In Progress,EMP-118,8,3114,14,9,3.1,High,3,Pandas; Tableau; NumPy; Microservices; Communication; Swift
PROJ-251,Evolution Framework Advanced,"Pioneer an enterprise-grade compliance tool for the pharmaceutical market focused on enhance scalability capabilities. Employing serverless computing framework strategy, the implementation features federated learning system, manages technical debt resolution, and targets key performance indicators such as better resource utilization.",2024-01-19,2024-11-14,On Hold,EMP-106,12,6024,10,10,2.3,Low,1,PHP; Communication; Kubernetes; PyTorch
PROJ-252,Summit Data Core,"Formulate a cutting-edge software solution solution in the media entertainment domain aimed at facilitate global expansion. Based on functional programming paradigm framework, this endeavor delivers intuitive user experience, mitigates legacy system integration, and drives business value through improved security posture.",2024-03-15,2025-05-09,Not Started,EMP-114,4,10245,14,10,4.1,Medium,2,Node.js; Bash; Microservices; JavaScript
PROJ-253,Innovation Transformation Plus,"Create an enterprise-grade microservices architecture for the media entertainment market focused on improve user experience. Employing machine learning pipelines strategy, the implementation features federated learning system, manages legacy system integration, and targets key performance indicators such as higher system availability.",2024-02-25,2025-01-20,In Progress,EMP-116,6,8748,11,9,4.0,Medium,2,AWS; Express.js; NumPy; Redis; Leadership; MongoDB
PROJ-254,Revolution Optimization Pro,"Pioneer a cutting-edge mobile application solution in the automotive industry domain aimed at optimize supply chain. Based on test-driven development framework, this endeavor delivers natural language processing, mitigates scalability challenges, and drives business value through enhanced user satisfaction.",2024-02-06,2024-11-02,In Progress,EMP-115,5,5700,9,7,3.5,Medium,2,HTML; Python; GCP; MySQL; C#; REST API
PROJ-255,Catalyst Framework One,"Initiate a scalable API framework platform serving e-commerce organizations to improve data security measures. Utilizing continuous delivery pipeline methodology, this project introduces real-time analytics dashboard while overcoming user adoption strategies and demonstrating success through reduced maintenance overhead.",2024-02-16,2024-06-15,Completed,EMP-113,10,7614,4,5,2.0,Medium,2,PostgreSQL; Angular; NumPy; PyTorch; Java; C++; Linux
PROJ-256,Catalyst Framework Edge,"Implement a cutting-edge IoT ecosystem solution in the agricultural technology domain aimed at optimize resource allocation. Based on component-based architecture framework, this endeavor delivers comprehensive reporting suite, mitigates integration complexity, and drives business value through better decision support.",2024-02-14,2025-02-08,Not Started,EMP-111,10,5979,12,10,2.5,Medium,2,Angular; CI/CD; HTML; Vue.js; Django; Leadership
PROJ-257,Transformation Data Core,"Establish an enterprise-grade enterprise system for the automotive industry market focused on drive innovation initiatives. Employing microservices architecture strategy, the implementation features computer vision integration, manages change management, and targets key performance indicators such as better data accuracy.",2024-03-05,2024-10-01,In Progress,EMP-115,6,6396,7,5,3.4,Medium,2,Project Management; Data Analysis; C++; Azure; JavaScript; Microservices; SQL
PROJ-258,Apex AI Max,"Create an innovative compliance tool targeting logistics clients with the primary goal to increase market competitiveness. Built on cloud-native development principles, the solution incorporates natural language processing and navigates data privacy concerns to deliver measurable outcomes including enhanced data insights.",2024-02-27,2024-09-24,Not Started,EMP-108,10,6651,7,6,3.3,Low,1,C#; Kubernetes; TensorFlow; Docker
PROJ-259,Revolution AI Max,"Create an enterprise-grade compliance tool for the retail operations market focused on streamline operational workflows. Employing machine learning pipelines strategy, the implementation features predictive analytics capabilities, manages budget allocation limitations, and targets key performance indicators such as enhanced compliance status.",2024-02-12,2025-02-06,Not Started,EMP-117,3,4344,12,9,2.6,Medium,2,NumPy; MySQL; Scrum; React; REST API; Linux
PROJ-260,Revolution AI X,"Engineer an innovative mobile application targeting telecommunications clients with the primary goal to modernize legacy infrastructure. Built on event-driven design patterns principles, the solution incorporates real-time analytics dashboard and navigates disaster recovery planning to deliver measurable outcomes including reduced error rates.",2024-03-30,2024-12-25,In Progress,EMP-101,10,5028,9,7,3.4,Low,1,React; Microservices; MySQL; Docker; Kubernetes; Linux
PROJ-261,Innovation Solution 360,"Deploy a next-generation reporting system framework for the education technology industry to reduce operational costs. Using containerization strategy techniques, the architecture provides predictive analytics capabilities, handles disaster recovery planning, and improves business metrics including enhanced compliance status.",2024-03-20,2024-06-18,On Hold,EMP-114,4,3249,3,4,3.8,Low,1,GCP; Tableau; Problem Solving; Project Management
PROJ-262,Revolution System Max,"Implement a robust enterprise system infrastructure for agricultural technology applications to improve user experience. Following serverless computing framework best practices, the system includes federated learning system, addresses documentation standards, and optimizes for outcomes like better decision support.",2024-01-03,2024-04-02,In Progress,EMP-113,8,3882,3,4,3.5,Low,1,Git; MongoDB; Kubernetes; Pandas; Scrum
PROJ-263,Pinnacle Intelligence Prime,"Build an enterprise-grade automation system for the manufacturing market focused on automate manual processes. Employing domain-driven design principles strategy, the implementation features natural language processing, manages team skill development, and targets key performance indicators such as faster time-to-market.",2024-03-23,2024-05-22,In Progress,EMP-100,3,3309,2,3,2.4,Low,1,Data Analysis; GCP; Swift; Rust; GraphQL; Ruby; Microservices; Java
PROJ-264,Summit Intelligence Elite,"Initiate a robust microservices architecture infrastructure for automotive industry applications to enhance scalability capabilities. Following microservices architecture best practices, the system includes seamless third-party integrations, addresses team skill development, and optimizes for outcomes like increased processing speed.",2024-03-03,2024-09-29,Not Started,EMP-117,6,6945,7,5,2.1,Medium,2,Machine Learning; Problem Solving; C#; Jenkins; TensorFlow
PROJ-265,Horizon Optimization Premium,"Construct an intelligent cloud infrastructure ecosystem serving media entertainment needs to optimize supply chain. Through containerization strategy implementation, the platform offers predictive analytics capabilities, resolves quality assurance processes, and enhances operational efficiency via better decision support.",2024-01-21,2024-06-19,On Hold,EMP-115,10,6714,5,5,2.9,Medium,2,SQL; C++; Redis; AWS; Django
PROJ-266,Catalyst System Unlimited,"Construct a robust enterprise system infrastructure for media entertainment applications to increase market competitiveness. Following machine learning pipelines best practices, the system includes augmented reality features, addresses scalability challenges, and optimizes for outcomes like increased system reliability.",2024-02-25,2024-09-22,Not Started,EMP-106,4,7488,7,7,2.7,Medium,2,PostgreSQL; Python; MySQL; PyTorch; PHP
PROJ-267,Genesis AI Unlimited,"Institute an innovative microservices architecture targeting non-profit clients with the primary goal to accelerate decision-making processes. Built on progressive enhancement principles, the solution incorporates scalable infrastructure and navigates security vulnerability mitigation to deliver measurable outcomes including reduced maintenance overhead.",2024-02-12,2024-09-09,Not Started,EMP-116,5,5406,7,6,2.0,Medium,2,Bash; Agile; Pandas; Project Management; Communication; Python; HTML; MongoDB
PROJ-268,Evolution Enterprise Advanced,"Build a cutting-edge AI-powered tool solution in the logistics domain aimed at improve product quality. Based on microservices architecture framework, this endeavor delivers advanced security protocols, mitigates cross-team coordination, and drives business value through better decision support.",2024-01-21,2024-05-20,Completed,EMP-110,3,2256,4,3,3.9,Low,1,Git; Bash; GCP; AWS; TensorFlow; Express.js; Jenkins; HTML
PROJ-269,Nexus Intelligence Plus,"Deploy an intelligent reporting system ecosystem serving retail operations needs to enable real-time insights. Through infrastructure as code implementation, the platform offers seamless third-party integrations, resolves documentation standards, and enhances operational efficiency via improved system performance.",2024-01-12,2024-10-08,Not Started,EMP-109,5,6405,9,8,2.1,High,3,Ruby; CI/CD; Node.js; Java; PyTorch; Linux
PROJ-270,Genesis Analytics Ultimate,"Construct an intelligent API framework ecosystem serving manufacturing needs to strengthen compliance protocols. Through microservices architecture implementation, the platform offers comprehensive reporting suite, resolves scalability challenges, and enhances operational efficiency via increased system reliability.",2024-03-13,2024-12-08,In Progress,EMP-103,8,4146,9,9,3.3,High,3,Machine Learning; CSS; Bash; Leadership; Agile; SQL; Swift
PROJ-271,Synergy Platform Enterprise,"Launch a scalable security framework platform serving logistics organizations to increase market competitiveness. Utilizing functional programming paradigm methodology, this project introduces voice-enabled interactions while overcoming integration complexity and demonstrating success through increased automation rate.",2024-02-01,2024-07-30,Not Started,EMP-102,5,4986,6,5,4.2,Medium,2,PHP; MongoDB; Rust; Kubernetes; Express.js
PROJ-272,Transformation Automation Max,"Design an intelligent security framework ecosystem serving agricultural technology needs to improve data security measures. Through containerization strategy implementation, the platform offers advanced security protocols, resolves scalability challenges, and enhances operational efficiency via better decision support.",2024-02-08,2024-08-06,On Hold,EMP-108,6,4602,6,4,4.0,Medium,2,Swift; Problem Solving; HTML; Rust; Vue.js; React; Scrum
PROJ-273,Odyssey Optimization Edge,"Roll out an enterprise-grade blockchain network for the telecommunications market focused on enable real-time insights. Employing data mesh architecture strategy, the implementation features real-time analytics dashboard, manages documentation standards, and targets key performance indicators such as improved team productivity.",2024-03-08,2024-10-04,Not Started,EMP-101,8,6225,7,6,2.6,High,3,Leadership; Scrum; Spring; Communication; Azure; PHP
