project_id,project_name,description,start_date,deadline,status,manager_id,Team_Size,Project_Budget_USD,Estimated_Timeline_Months,Complexity_Score,Team_Experience_Level,Priority,Priority_Score,required_skillsets
PROJ-492,Synergy Data Elite,"Create an enterprise-grade progressive web app for the financial services market focused on optimize supply chain. Employing progressive enhancement strategy, the implementation features AI-assisted functionality, manages cross-team coordination, and targets key performance indicators such as better resource utilization.",2024-01-25,2025-02-18,Not Started,EMP-103,6,5082,13,9,3.7,High,3,Rust; Vue.js; Data Analysis; CSS; Azure; Git; Project Management
PROJ-493,Nexus AI Elite,"Initiate a next-generation machine learning model framework for the government industry to accelerate decision-making processes. Using continuous delivery pipeline techniques, the architecture provides quantum-resistant cryptography, handles team skill development, and improves business metrics including improved security posture.",2024-02-18,2024-08-16,In Progress,EMP-114,8,7134,6,5,3.7,Medium,2,Spring; C++; Swift; Python; MongoDB; NumPy; Machine Learning
PROJ-494,Frontier Analytics Prime,"Construct an intelligent software solution ecosystem serving telecommunications needs to enhance scalability capabilities. Through zero-trust security model implementation, the platform offers predictive analytics capabilities, resolves aggressive timeline constraints, and enhances operational efficiency via improved system performance.",2024-02-29,2024-08-27,Not Started,EMP-111,12,2910,6,5,3.0,Medium,2,Docker; Node.js; Swift; Microservices; REST API; SQL; PHP
PROJ-495,Nexus Data Max,"Introduce a robust machine learning model infrastructure for retail operations applications to increase market competitiveness. Following functional programming paradigm best practices, the system includes voice-enabled interactions, addresses data migration complexities, and optimizes for outcomes like better data accuracy.",2024-03-21,2024-10-17,In Progress,EMP-102,12,7608,7,6,2.2,High,3,Agile; PyTorch; Python; Go; Problem Solving; Data Analysis; Scrum; Django
PROJ-496,Vertex Initiative Prime,"Design a comprehensive automation system for the pharmaceutical sector designed to strengthen compliance protocols. Leveraging API-first methodology, this initiative will deliver intuitive user experience while addressing budget allocation limitations, ultimately achieving improved security posture.",2024-01-26,2024-06-24,On Hold,EMP-102,10,1488,5,6,2.4,Medium,2,Go; Scrum; R; HTML; MongoDB; Rust; MySQL; Python
PROJ-497,Genesis Digital Plus,"Launch a robust software solution infrastructure for manufacturing applications to facilitate global expansion. Following component-based architecture best practices, the system includes scalable infrastructure, addresses regulatory compliance requirements, and optimizes for outcomes like increased processing speed.",2024-01-25,2024-07-23,Not Started,EMP-104,10,5211,6,7,2.7,Medium,2,Go; Kubernetes; AWS; SQL; Python
PROJ-498,Pinnacle Integration Edge,"Construct a next-generation progressive web app framework for the pharmaceutical industry to strengthen compliance protocols. Using data mesh architecture techniques, the architecture provides scalable infrastructure, handles data privacy concerns, and improves business metrics including reduced operational costs.",2024-01-22,2024-12-17,Not Started,EMP-108,3,2997,11,8,4.9,High,3,Go; MongoDB; PyTorch; NumPy; Agile; TensorFlow; Linux
PROJ-499,Acceleration Program Prime,"Create a next-generation cloud infrastructure framework for the e-commerce industry to accelerate decision-making processes. Using component-based architecture techniques, the architecture provides edge computing capabilities, handles technical debt resolution, and improves business metrics including improved system performance.",2024-01-07,2024-10-03,On Hold,EMP-118,5,7677,9,8,2.7,Medium,2,MongoDB; AWS; Go; Scrum
PROJ-500,Genesis Optimization Unlimited,"Formulate a scalable machine learning model platform serving gaming organizations to improve data security measures. Utilizing event-driven design patterns methodology, this project introduces AI-assisted functionality while overcoming performance optimization and demonstrating success through reduced error rates.",2024-03-06,2024-12-01,Not Started,EMP-108,8,6288,9,7,3.3,Medium,2,Microservices; Kubernetes; PHP; Linux
PROJ-501,Vanguard Framework Plus,"Introduce a scalable reporting system platform serving non-profit organizations to accelerate decision-making processes. Utilizing agile development practices methodology, this project introduces responsive user interface while overcoming aggressive timeline constraints and demonstrating success through better user engagement.",2024-02-04,2024-09-01,In Progress,EMP-111,3,7143,7,6,4.4,Low,1,Bash; React; Vue.js; Express.js; Jenkins; Ruby; CI/CD
PROJ-502,Catalyst Automation Pro,"Establish a cutting-edge data analytics solution in the e-commerce domain aimed at optimize supply chain. Based on continuous delivery pipeline framework, this endeavor delivers automated workflow engine, mitigates performance optimization, and drives business value through increased processing speed.",2024-02-09,2024-09-06,In Progress,EMP-108,3,5583,7,6,4.4,Medium,2,Linux; MySQL; Kubernetes; C++; Vue.js; Go; GraphQL; C#
PROJ-503,Frontier Optimization Advanced,"Deploy a next-generation software solution framework for the government industry to strengthen compliance protocols. Using functional programming paradigm techniques, the architecture provides natural language processing, handles cross-team coordination, and improves business metrics including increased system reliability.",2024-01-13,2024-04-12,Not Started,EMP-109,5,2778,3,3,4.2,Medium,2,MongoDB; CSS; Communication; Azure; Project Management; Python; HTML; TensorFlow
PROJ-504,Synergy Automation Enterprise,"Implement an enterprise-grade blockchain network for the healthcare market focused on increase market competitiveness. Employing API-first methodology strategy, the implementation features predictive analytics capabilities, manages budget allocation limitations, and targets key performance indicators such as better data accuracy.",2024-02-23,2025-01-18,Completed,EMP-105,5,5127,11,10,3.2,High,3,Django; Node.js; Express.js; Machine Learning; Tableau; C++
PROJ-505,Pinnacle Enterprise Edge,"Engineer a scalable progressive web app platform serving telecommunications organizations to improve user experience. Utilizing progressive enhancement methodology, this project introduces seamless third-party integrations while overcoming vendor management and demonstrating success through increased automation rate.",2024-01-14,2024-10-10,In Progress,EMP-103,4,5541,9,9,3.9,High,3,Node.js; R; Express.js; Machine Learning
PROJ-506,Vertex Optimization Ultimate,"Formulate an innovative mobile application targeting media entertainment clients with the primary goal to enable real-time insights. Built on zero-trust security model principles, the solution incorporates real-time analytics dashboard and navigates disaster recovery planning to deliver measurable outcomes including faster time-to-market.",2024-01-09,2024-06-07,Not Started,EMP-119,4,5706,5,3,4.6,Low,1,R; Microservices; Spring; REST API; Django; Jenkins; Tableau; Vue.js
PROJ-507,Genesis Framework 360,"Initiate a comprehensive enterprise system for the travel hospitality sector designed to boost productivity metrics. Leveraging continuous delivery pipeline, this initiative will deliver advanced security protocols while addressing technical debt resolution, ultimately achieving increased customer retention.",2024-02-10,2025-02-04,In Progress,EMP-108,6,5613,12,8,3.8,Low,1,CI/CD; GraphQL; Agile; Flask; Problem Solving
PROJ-508,Vertex Solution Premium,"Introduce a cutting-edge machine learning model solution in the gaming domain aimed at enhance scalability capabilities. Based on event-driven design patterns framework, this endeavor delivers edge computing capabilities, mitigates integration complexity, and drives business value through increased system reliability.",2024-03-23,2024-08-20,Completed,EMP-100,12,3753,5,6,2.1,Medium,2,Node.js; Problem Solving; Ruby; Java; AWS; Azure; C++; NumPy
PROJ-509,Synergy Initiative Elite,"Construct a scalable data analytics platform serving travel hospitality organizations to optimize supply chain. Utilizing functional programming paradigm methodology, this project introduces federated learning system while overcoming data privacy concerns and demonstrating success through improved team productivity.",2024-02-06,2024-08-04,On Hold,EMP-118,6,6123,6,6,3.3,Medium,2,Flask; Ruby; PyTorch; Swift; Django; Node.js; MySQL; JavaScript
PROJ-510,Transformation Data X,"Engineer a next-generation software solution framework for the travel hospitality industry to expand service offerings. Using data mesh architecture techniques, the architecture provides augmented reality features, handles technology stack modernization, and improves business metrics including higher system availability.",2024-01-16,2025-02-09,On Hold,EMP-107,6,3570,13,8,4.3,High,3,AWS; Ruby; Agile; Git; CI/CD; Data Analysis; Express.js
PROJ-511,Apex Program Plus,"Introduce an innovative blockchain network targeting retail operations clients with the primary goal to optimize resource allocation. Built on domain-driven design principles principles, the solution incorporates augmented reality features and navigates user adoption strategies to deliver measurable outcomes including reduced operational costs.",2024-03-24,2024-09-20,Not Started,EMP-117,12,6165,6,5,2.6,Low,1,C#; Go; SQL; Tableau; Flask
PROJ-512,Vertex Analytics Pro,"Deploy a next-generation monitoring solution framework for the pharmaceutical industry to streamline operational workflows. Using responsive design system techniques, the architecture provides edge computing capabilities, handles cross-team coordination, and improves business metrics including improved team productivity.",2024-03-09,2024-12-04,In Progress,EMP-103,6,5505,9,7,3.9,Medium,2,CI/CD; Project Management; Angular; Rust; Problem Solving; Spring; C++; Redis
PROJ-513,Horizon Program Enterprise,"Develop a next-generation real-time dashboard framework for the non-profit industry to facilitate global expansion. Using DevOps implementation techniques, the architecture provides edge computing capabilities, handles disaster recovery planning, and improves business metrics including enhanced user satisfaction.",2024-03-26,2024-07-24,Completed,EMP-108,5,4947,4,5,3.8,High,3,Python; Git; Agile; HTML; Kubernetes; PHP; AWS; Pandas
PROJ-514,Horizon Optimization 360,"Design a robust compliance tool infrastructure for travel hospitality applications to enhance customer engagement. Following responsive design system best practices, the system includes computer vision integration, addresses data privacy concerns, and optimizes for outcomes like higher system availability.",2024-03-17,2024-12-12,Completed,EMP-115,5,8661,9,8,3.9,High,3,Bash; Azure; Agile; Docker; JavaScript; NumPy
PROJ-515,Nexus Integration Unlimited,"Deploy an enterprise-grade security framework for the retail operations market focused on modernize legacy infrastructure. Employing agile development practices strategy, the implementation features real-time analytics dashboard, manages documentation standards, and targets key performance indicators such as reduced maintenance overhead.",2024-02-09,2024-08-07,Not Started,EMP-105,6,2928,6,5,3.5,High,3,SQL; PostgreSQL; JavaScript; Bash; Python; Redis; GraphQL; Flask
PROJ-516,Genesis Intelligence Pro,"Roll out a comprehensive digital platform for the cybersecurity sector designed to automate manual processes. Leveraging test-driven development, this initiative will deliver predictive analytics capabilities while addressing integration complexity, ultimately achieving increased processing speed.",2024-01-30,2024-12-25,Not Started,EMP-111,6,7008,11,8,3.4,Medium,2,Microservices; PHP; PostgreSQL; Angular; Express.js
PROJ-517,Synergy Cloud Next,"Formulate an innovative security framework targeting energy sector clients with the primary goal to optimize resource allocation. Built on reactive programming principles, the solution incorporates edge computing capabilities and navigates cross-team coordination to deliver measurable outcomes including increased automation rate.",2024-01-26,2024-09-22,On Hold,EMP-100,5,3708,8,7,4.3,High,3,CSS; Data Analysis; Linux; PostgreSQL
PROJ-518,Catalyst Initiative Edge,"Construct an innovative API framework targeting retail operations clients with the primary goal to facilitate global expansion. Built on responsive design system principles, the solution incorporates scalable infrastructure and navigates quality assurance processes to deliver measurable outcomes including increased customer retention.",2024-03-19,2024-07-17,On Hold,EMP-114,10,3126,4,5,3.2,High,3,PyTorch; Scrum; AWS; HTML; Docker; Linux; Swift
PROJ-519,Nexus Program Advanced,"Develop an intelligent API framework ecosystem serving energy sector needs to accelerate decision-making processes. Through agile development practices implementation, the platform offers predictive analytics capabilities, resolves regulatory compliance requirements, and enhances operational efficiency via better data accuracy.",2024-03-03,2024-10-29,On Hold,EMP-102,5,5010,8,6,3.1,Medium,2,Redis; GraphQL; R; MySQL; Spring; Flask
PROJ-520,Synergy Framework 360,"Engineer an intelligent cloud infrastructure ecosystem serving agricultural technology needs to enhance scalability capabilities. Through functional programming paradigm implementation, the platform offers computer vision integration, resolves cross-team coordination, and enhances operational efficiency via enhanced compliance status.",2024-02-14,2025-01-09,Not Started,EMP-109,15,9846,11,9,2.9,High,3,Java; HTML; Spring; NumPy; Django; AWS; Jenkins
PROJ-521,Odyssey Transformation One,"Design an intelligent mobile application ecosystem serving travel hospitality needs to drive innovation initiatives. Through microservices architecture implementation, the platform offers comprehensive reporting suite, resolves regulatory compliance requirements, and enhances operational efficiency via enhanced compliance status.",2024-02-20,2024-08-18,Completed,EMP-100,5,2895,6,6,2.9,High,3,MongoDB; PostgreSQL; HTML; Problem Solving
PROJ-522,Pinnacle Digital Ultimate,"Pioneer an enterprise-grade enterprise system for the agricultural technology market focused on expand service offerings. Employing data mesh architecture strategy, the implementation features advanced security protocols, manages change management, and targets key performance indicators such as higher system availability.",2024-02-06,2025-01-01,In Progress,EMP-109,2,5781,11,8,4.3,Medium,2,CSS; Data Analysis; Express.js; Angular
PROJ-523,Nexus Cloud Advanced,"Pioneer an enterprise-grade cloud infrastructure for the government market focused on strengthen data governance. Employing serverless computing framework strategy, the implementation features intuitive user experience, manages documentation standards, and targets key performance indicators such as better data accuracy.",2024-02-12,2024-10-09,In Progress,EMP-118,4,4575,8,6,3.8,Low,1,TensorFlow; SQL; PyTorch; C++; Project Management; Communication; Rust
PROJ-524,Horizon AI Ultimate,"Formulate a cutting-edge digital platform solution in the cybersecurity domain aimed at increase market competitiveness. Based on containerization strategy framework, this endeavor delivers automated workflow engine, mitigates data privacy concerns, and drives business value through increased automation rate.",2024-03-14,2024-07-12,On Hold,EMP-109,3,3966,4,4,3.9,Medium,2,Pandas; PostgreSQL; Java; PyTorch; Django
PROJ-525,Horizon AI Plus,"Implement a cutting-edge compliance tool solution in the agricultural technology domain aimed at enhance customer engagement. Based on domain-driven design principles framework, this endeavor delivers responsive user interface, mitigates vendor management, and drives business value through improved scalability.",2024-03-18,2024-07-16,In Progress,EMP-114,4,2520,4,5,2.8,High,3,Git; AWS; R; SQL; Angular; TensorFlow; Machine Learning
PROJ-526,Innovation Intelligence Core,"Implement an innovative digital platform targeting healthcare clients with the primary goal to boost productivity metrics. Built on agile development practices principles, the solution incorporates predictive analytics capabilities and navigates team skill development to deliver measurable outcomes including increased customer retention.",2024-02-02,2024-09-29,Completed,EMP-105,2,7107,8,7,4.2,Medium,2,Project Management; Swift; Vue.js; Spring; Azure; NumPy
PROJ-527,Momentum Analytics Enterprise,"Create a robust cloud infrastructure infrastructure for financial services applications to optimize supply chain. Following API-first methodology best practices, the system includes AI-assisted functionality, addresses integration complexity, and optimizes for outcomes like improved scalability.",2024-03-19,2025-03-14,Not Started,EMP-115,5,6441,12,8,4.1,Medium,2,Scrum; CI/CD; Go; GraphQL; PHP; Machine Learning
PROJ-528,Vanguard Data Unlimited,"Design an innovative integration hub targeting manufacturing clients with the primary goal to enhance customer engagement. Built on machine learning pipelines principles, the solution incorporates intuitive user experience and navigates budget allocation limitations to deliver measurable outcomes including better decision support.",2024-02-13,2024-10-10,In Progress,EMP-104,12,7203,8,8,2.5,Low,1,C++; Problem Solving; HTML; Tableau; MongoDB; Ruby; Python; Machine Learning
PROJ-529,Vertex Automation Enterprise,"Construct a robust mobile application infrastructure for healthcare applications to improve data security measures. Following agile development practices best practices, the system includes augmented reality features, addresses quality assurance processes, and optimizes for outcomes like increased customer retention.",2024-02-06,2024-08-04,On Hold,EMP-108,8,4380,6,6,4.5,High,3,Bash; MongoDB; PyTorch; TensorFlow; Leadership; JavaScript; GCP
PROJ-530,Nexus Enterprise Prime,"Formulate a cutting-edge compliance tool solution in the government domain aimed at streamline operational workflows. Based on serverless computing framework framework, this endeavor delivers federated learning system, mitigates vendor management, and drives business value through better data accuracy.",2024-02-16,2024-07-15,On Hold,EMP-102,4,4014,5,6,4.0,Low,1,Scrum; Redis; Django; Data Analysis; Problem Solving; AWS; Git; Machine Learning
PROJ-531,Momentum Program Pro,"Construct an intelligent compliance tool ecosystem serving e-commerce needs to reduce operational costs. Through progressive enhancement implementation, the platform offers edge computing capabilities, resolves data privacy concerns, and enhances operational efficiency via reduced error rates.",2024-02-14,2024-07-13,In Progress,EMP-110,10,3513,5,4,2.3,Low,1,Scrum; Data Analysis; Node.js; Machine Learning; Express.js; JavaScript
PROJ-532,Pinnacle Optimization 360,"Establish a cutting-edge reporting system solution in the financial services domain aimed at drive innovation initiatives. Based on progressive enhancement framework, this endeavor delivers edge computing capabilities, mitigates change management, and drives business value through increased customer retention.",2024-01-18,2024-07-16,In Progress,EMP-118,4,7884,6,7,3.6,High,3,Django; Node.js; Azure; Communication; Project Management; Redis
PROJ-533,Horizon Enterprise 360,"Construct a scalable software solution platform serving non-profit organizations to expand service offerings. Utilizing domain-driven design principles methodology, this project introduces automated workflow engine while overcoming cross-team coordination and demonstrating success through increased customer retention.",2024-03-12,2024-06-10,Not Started,EMP-108,5,1629,3,3,3.6,Low,1,GraphQL; Python; Microservices; Data Analysis
PROJ-534,Vanguard Solution Pro,"Roll out an intelligent integration hub ecosystem serving travel hospitality needs to boost productivity metrics. Through containerization strategy implementation, the platform offers distributed ledger technology, resolves vendor management, and enhances operational efficiency via better data accuracy.",2024-02-07,2024-07-06,Completed,EMP-108,5,7647,5,6,3.6,High,3,GraphQL; SQL; Angular; Git; Project Management; Ruby
PROJ-535,Revolution Enterprise Max,"Construct an intelligent IoT ecosystem ecosystem serving telecommunications needs to modernize legacy infrastructure. Through microservices architecture implementation, the platform offers distributed ledger technology, resolves documentation standards, and enhances operational efficiency via increased processing speed.",2024-01-09,2025-02-02,In Progress,EMP-103,8,5271,13,9,3.4,High,3,Vue.js; C++; Tableau; Spring; Rust; Data Analysis
PROJ-536,Apex Transformation Premium,"Initiate an intelligent IoT ecosystem ecosystem serving energy sector needs to improve product quality. Through zero-trust security model implementation, the platform offers advanced security protocols, resolves technology stack modernization, and enhances operational efficiency via faster time-to-market.",2024-03-14,2025-04-08,On Hold,EMP-118,8,4980,13,9,3.0,Medium,2,Git; C++; Pandas; Agile; Swift; MySQL; Leadership
PROJ-537,Genesis Enterprise Enterprise,"Launch a cutting-edge data analytics solution in the energy sector domain aimed at improve product quality. Based on component-based architecture framework, this endeavor delivers scalable infrastructure, mitigates security vulnerability mitigation, and drives business value through improved system performance.",2024-02-09,2025-02-03,In Progress,EMP-112,6,5976,12,8,4.4,Medium,2,Problem Solving; Microservices; Jenkins; REST API; HTML
PROJ-538,Genesis Platform 360,"Build a comprehensive real-time dashboard for the education technology sector designed to automate manual processes. Leveraging zero-trust security model, this initiative will deliver responsive user interface while addressing change management, ultimately achieving better data accuracy.",2024-02-04,2024-08-02,Not Started,EMP-104,5,8160,6,7,3.6,Medium,2,Redis; REST API; Linux; Kubernetes; Jenkins; Node.js; Bash
PROJ-539,Revolution AI Enterprise,"Implement a comprehensive mobile application for the education technology sector designed to optimize resource allocation. Leveraging continuous delivery pipeline, this initiative will deliver advanced security protocols while addressing disaster recovery planning, ultimately achieving improved system performance.",2024-03-10,2024-09-06,In Progress,EMP-108,6,4242,6,6,4.6,High,3,PyTorch; CI/CD; Machine Learning; Jenkins
PROJ-540,Pinnacle Optimization 360,"Design a scalable security framework platform serving gaming organizations to automate manual processes. Utilizing serverless computing framework methodology, this project introduces predictive analytics capabilities while overcoming user adoption strategies and demonstrating success through improved team productivity.",2024-02-21,2024-07-20,Not Started,EMP-113,10,2526,5,6,3.4,Low,1,Problem Solving; Agile; C++; JavaScript; Go; Express.js; Angular; Java
PROJ-541,Horizon Automation Prime,"Implement a comprehensive cloud infrastructure for the non-profit sector designed to strengthen compliance protocols. Leveraging event-driven design patterns, this initiative will deliver edge computing capabilities while addressing scalability challenges, ultimately achieving better data accuracy.",2024-03-05,2024-10-31,In Progress,EMP-112,6,4743,8,6,4.0,High,3,Flask; R; TensorFlow; GCP
PROJ-542,Frontier System Core,"Roll out an enterprise-grade machine learning model for the education technology market focused on improve user experience. Employing event-driven design patterns strategy, the implementation features computer vision integration, manages aggressive timeline constraints, and targets key performance indicators such as increased processing speed.",2024-03-26,2025-02-19,Not Started,EMP-115,3,4923,11,9,3.3,Medium,2,Communication; Docker; Angular; Scrum; Django; Spring
PROJ-543,Synergy Data One,"Roll out a robust enterprise system infrastructure for healthcare applications to strengthen data governance. Following API-first methodology best practices, the system includes scalable infrastructure, addresses scalability challenges, and optimizes for outcomes like enhanced data insights.",2024-01-19,2024-06-17,Completed,EMP-111,5,6858,5,5,4.2,Medium,2,Git; CI/CD; Docker; HTML; NumPy; Angular; PyTorch
PROJ-544,Evolution Transformation Enterprise,"Create a scalable IoT ecosystem platform serving pharmaceutical organizations to facilitate global expansion. Utilizing continuous delivery pipeline methodology, this project introduces seamless third-party integrations while overcoming legacy system integration and demonstrating success through better data accuracy.",2024-01-27,2024-09-23,Not Started,EMP-109,5,5496,8,6,4.3,Medium,2,REST API; JavaScript; Git; NumPy; Data Analysis; Ruby; CSS
PROJ-545,Innovation Automation Core,"Formulate a robust IoT ecosystem infrastructure for logistics applications to optimize resource allocation. Following test-driven development best practices, the system includes advanced security protocols, addresses aggressive timeline constraints, and optimizes for outcomes like reduced maintenance overhead.",2024-03-20,2024-10-16,In Progress,EMP-117,6,6894,7,6,4.1,Medium,2,Azure; Go; AWS; Django; C++; Agile; Express.js
