project_id,project_name,description,start_date,deadline,status,manager_id,Team_Size,Project_Budget_USD,Estimated_Timeline_Months,Complexity_Score,Team_Experience_Level,Priority,Priority_Score,required_skillsets
PROJ-764,Synergy Integration 360,"Construct an enterprise-grade AI-powered tool for the energy sector market focused on strengthen compliance protocols. Employing serverless computing framework strategy, the implementation features augmented reality features, manages vendor management, and targets key performance indicators such as faster time-to-market.",2024-02-01,2024-06-30,On Hold,EMP-119,12,5295,5,6,2.2,High,3,Tableau; HTML; CSS; SQL
PROJ-765,Acceleration Framework Enterprise,"Develop an enterprise-grade automation system for the energy sector market focused on improve user experience. Employing cloud-native development strategy, the implementation features natural language processing, manages technology stack modernization, and targets key performance indicators such as reduced maintenance overhead.",2024-03-24,2025-04-18,In Progress,EMP-112,15,4275,13,8,3.2,Medium,2,Machine Learning; Tableau; CI/CD; Jenkins; REST API; Leadership; Docker
PROJ-766,Odyssey Enterprise Advanced,"Introduce a robust reporting system infrastructure for government applications to accelerate decision-making processes. Following serverless computing framework best practices, the system includes intuitive user experience, addresses data migration complexities, and optimizes for outcomes like improved team productivity.",2024-03-26,2024-10-22,Not Started,EMP-103,5,4143,7,6,3.4,High,3,Scrum; AWS; Bash; C#; Pandas; C++
PROJ-767,Genesis Framework Edge,"Introduce a comprehensive API framework for the pharmaceutical sector designed to modernize legacy infrastructure. Leveraging reactive programming, this initiative will deliver responsive user interface while addressing technology stack modernization, ultimately achieving improved system performance.",2024-01-13,2024-08-10,Completed,EMP-108,4,7053,7,6,4.5,Medium,2,CSS; Leadership; MySQL; Git; Vue.js; AWS; Swift
PROJ-768,Vanguard Solution Elite,"Deploy a comprehensive enterprise system for the agricultural technology sector designed to strengthen compliance protocols. Leveraging DevOps implementation, this initiative will deliver seamless third-party integrations while addressing data privacy concerns, ultimately achieving improved team productivity.",2024-02-21,2024-09-18,In Progress,EMP-108,6,3060,7,7,3.0,High,3,Express.js; Problem Solving; Agile; TensorFlow; AWS; Leadership
PROJ-769,Summit Intelligence Ultimate,"Launch a comprehensive reporting system for the financial services sector designed to improve data security measures. Leveraging reactive programming, this initiative will deliver advanced security protocols while addressing cross-team coordination, ultimately achieving improved team productivity.",2024-01-13,2024-09-09,In Progress,EMP-114,6,3987,8,7,3.6,Low,1,Linux; CI/CD; MySQL; Java; Rust
PROJ-770,Summit Analytics Edge,"Formulate a scalable data analytics platform serving telecommunications organizations to drive innovation initiatives. Utilizing API-first methodology methodology, this project introduces scalable infrastructure while overcoming integration complexity and demonstrating success through increased processing speed.",2024-03-07,2024-07-05,Completed,EMP-115,4,7758,4,5,3.3,Low,1,Express.js; Node.js; Jenkins; Leadership; Swift
PROJ-771,Transformation Program Premium,"Initiate an intelligent digital platform ecosystem serving financial services needs to boost productivity metrics. Through microservices architecture implementation, the platform offers computer vision integration, resolves regulatory compliance requirements, and enhances operational efficiency via better data accuracy.",2024-03-15,2024-06-13,Not Started,EMP-118,5,2379,3,3,4.0,Low,1,Vue.js; Git; Flask; HTML; Pandas; Tableau; JavaScript
PROJ-772,Evolution Initiative Pro,"Develop a next-generation API framework framework for the education technology industry to optimize resource allocation. Using responsive design system techniques, the architecture provides seamless third-party integrations, handles data migration complexities, and improves business metrics including improved team productivity.",2024-03-06,2024-11-01,Completed,EMP-109,6,3138,8,7,4.1,High,3,R; TensorFlow; Redis; Git; Express.js; Rust; Problem Solving; PHP
PROJ-773,Momentum Initiative Next,"Pioneer an innovative security framework targeting insurance clients with the primary goal to improve data security measures. Built on test-driven development principles, the solution incorporates distributed ledger technology and navigates integration complexity to deliver measurable outcomes including better user engagement.",2024-03-07,2024-09-03,In Progress,EMP-109,4,2433,6,5,4.3,Medium,2,Leadership; PHP; Rust; Node.js; JavaScript; R; PostgreSQL; GCP
PROJ-774,Summit AI Max,"Design an enterprise-grade blockchain network for the e-commerce market focused on accelerate decision-making processes. Employing zero-trust security model strategy, the implementation features predictive analytics capabilities, manages disaster recovery planning, and targets key performance indicators such as increased processing speed.",2024-01-16,2024-05-15,Completed,EMP-109,3,4254,4,3,5.0,Low,1,PostgreSQL; Flask; PHP; Swift; Django
PROJ-775,Quantum Initiative Plus,"Design a comprehensive microservices architecture for the agricultural technology sector designed to facilitate global expansion. Leveraging API-first methodology, this initiative will deliver quantum-resistant cryptography while addressing regulatory compliance requirements, ultimately achieving reduced maintenance overhead.",2024-01-30,2024-05-29,In Progress,EMP-109,4,4749,4,4,3.0,High,3,Git; Node.js; Pandas; Microservices; SQL
PROJ-776,Genesis Integration Advanced,"Launch an enterprise-grade progressive web app for the media entertainment market focused on streamline operational workflows. Employing machine learning pipelines strategy, the implementation features computer vision integration, manages team skill development, and targets key performance indicators such as improved scalability.",2024-01-06,2024-06-04,On Hold,EMP-106,8,2502,5,3,3.5,Medium,2,Django; Kubernetes; Docker; Agile; Vue.js; Node.js; Azure; HTML
PROJ-777,Revolution Integration 360,"Engineer a scalable monitoring solution platform serving automotive industry organizations to accelerate decision-making processes. Utilizing continuous delivery pipeline methodology, this project introduces edge computing capabilities while overcoming user adoption strategies and demonstrating success through enhanced compliance status.",2024-02-26,2024-10-23,Completed,EMP-100,4,4695,8,7,2.8,Medium,2,GCP; Tableau; Data Analysis; Rust; Go; Problem Solving; Scrum
PROJ-778,Vertex Framework One,"Introduce an innovative IoT ecosystem targeting e-commerce clients with the primary goal to facilitate global expansion. Built on responsive design system principles, the solution incorporates real-time analytics dashboard and navigates quality assurance processes to deliver measurable outcomes including better data accuracy.",2024-02-14,2024-12-10,In Progress,EMP-109,6,6813,10,8,4.0,Medium,2,Communication; Scrum; Kubernetes; Problem Solving; Data Analysis; NumPy; Agile
PROJ-779,Momentum Initiative Next,"Roll out an intelligent machine learning model ecosystem serving automotive industry needs to enable real-time insights. Through functional programming paradigm implementation, the platform offers seamless third-party integrations, resolves change management, and enhances operational efficiency via higher system availability.",2024-01-30,2024-06-28,Not Started,EMP-103,15,1815,5,4,3.0,High,3,Data Analysis; Docker; Go; Express.js; Angular; React; Pandas; Machine Learning
PROJ-780,Revolution Digital Premium,"Establish a comprehensive API framework for the government sector designed to strengthen data governance. Leveraging API-first methodology, this initiative will deliver quantum-resistant cryptography while addressing change management, ultimately achieving enhanced data insights.",2024-01-17,2024-09-13,Completed,EMP-112,4,3243,8,6,3.5,High,3,Project Management; Problem Solving; GraphQL; Jenkins; Data Analysis; Machine Learning
PROJ-781,Nexus Analytics One,"Launch an intelligent cloud infrastructure ecosystem serving telecommunications needs to strengthen data governance. Through DevOps implementation implementation, the platform offers advanced security protocols, resolves quality assurance processes, and enhances operational efficiency via better user engagement.",2024-03-28,2024-09-24,On Hold,EMP-101,2,4641,6,6,5.0,High,3,CSS; SQL; MySQL; NumPy; Leadership; Redis
PROJ-782,Summit Enterprise Enterprise,"Introduce an innovative real-time dashboard targeting pharmaceutical clients with the primary goal to automate manual processes. Built on test-driven development principles, the solution incorporates advanced security protocols and navigates security vulnerability mitigation to deliver measurable outcomes including improved system performance.",2024-01-25,2024-09-21,Not Started,EMP-103,10,3339,8,7,3.5,Medium,2,Problem Solving; PostgreSQL; PyTorch; JavaScript; Go; Angular; React; R
PROJ-783,Horizon Intelligence Enterprise,"Formulate an intelligent mobile application ecosystem serving logistics needs to enhance scalability capabilities. Through serverless computing framework implementation, the platform offers comprehensive reporting suite, resolves data privacy concerns, and enhances operational efficiency via higher system availability.",2024-03-08,2024-06-06,In Progress,EMP-102,6,5880,3,4,3.9,Low,1,NumPy; AWS; CSS; Communication; PyTorch
PROJ-784,Quantum Framework One,"Engineer a scalable mobile application platform serving real estate organizations to accelerate decision-making processes. Utilizing machine learning pipelines methodology, this project introduces advanced security protocols while overcoming budget allocation limitations and demonstrating success through better decision support.",2024-01-08,2024-10-04,Not Started,EMP-109,4,8397,9,7,3.8,High,3,Problem Solving; Redis; Jenkins; CI/CD; R; Express.js
PROJ-785,Pinnacle Solution Prime,"Pioneer a scalable blockchain network platform serving automotive industry organizations to strengthen compliance protocols. Utilizing event-driven design patterns methodology, this project introduces distributed ledger technology while overcoming disaster recovery planning and demonstrating success through better decision support.",2024-02-05,2024-07-04,Completed,EMP-104,6,1839,5,4,3.2,Low,1,HTML; Rust; SQL; Kubernetes; Communication; GraphQL
PROJ-786,Frontier Digital Unlimited,"Create an innovative automation system targeting agricultural technology clients with the primary goal to improve product quality. Built on serverless computing framework principles, the solution incorporates computer vision integration and navigates security vulnerability mitigation to deliver measurable outcomes including faster time-to-market.",2024-03-05,2025-04-29,On Hold,EMP-111,5,4623,14,10,3.7,Low,1,AWS; GraphQL; CI/CD; Pandas; Express.js; Ruby; Kubernetes; Redis
PROJ-787,Frontier System Pro,"Formulate an intelligent software solution ecosystem serving manufacturing needs to modernize legacy infrastructure. Through continuous delivery pipeline implementation, the platform offers mobile-optimized design, resolves change management, and enhances operational efficiency via enhanced compliance status.",2024-01-08,2024-07-06,Not Started,EMP-103,3,7215,6,7,3.4,High,3,C#; Microservices; REST API; Data Analysis; React; Linux
PROJ-788,Revolution Analytics Prime,"Pioneer an innovative blockchain network targeting gaming clients with the primary goal to enhance scalability capabilities. Built on DevOps implementation principles, the solution incorporates quantum-resistant cryptography and navigates scalability challenges to deliver measurable outcomes including increased customer retention.",2024-01-29,2024-11-24,Not Started,EMP-100,4,5256,10,9,3.4,High,3,Azure; Express.js; Django; Vue.js; MySQL; SQL; Angular
PROJ-789,Frontier Integration Max,"Create an intelligent reporting system ecosystem serving manufacturing needs to improve product quality. Through event-driven design patterns implementation, the platform offers responsive user interface, resolves technical debt resolution, and enhances operational efficiency via improved scalability.",2024-03-01,2024-09-27,Not Started,EMP-115,5,8082,7,6,3.5,High,3,Rust; Agile; GraphQL; JavaScript
PROJ-790,Quantum Integration X,"Construct an innovative real-time dashboard targeting financial services clients with the primary goal to increase market competitiveness. Built on machine learning pipelines principles, the solution incorporates scalable infrastructure and navigates legacy system integration to deliver measurable outcomes including enhanced compliance status.",2024-01-31,2024-08-28,Completed,EMP-115,8,8694,7,7,3.0,Medium,2,Communication; MongoDB; Vue.js; C++; Go; Machine Learning; Scrum
PROJ-791,Momentum Optimization Core,"Roll out a cutting-edge API framework solution in the education technology domain aimed at modernize legacy infrastructure. Based on progressive enhancement framework, this endeavor delivers automated workflow engine, mitigates user adoption strategies, and drives business value through better decision support.",2024-01-23,2024-07-21,On Hold,EMP-104,8,5277,6,4,3.2,Medium,2,Vue.js; R; C#; Problem Solving; CSS
PROJ-792,Vertex System Prime,"Roll out an enterprise-grade data analytics for the pharmaceutical market focused on optimize resource allocation. Employing test-driven development strategy, the implementation features blockchain verification, manages disaster recovery planning, and targets key performance indicators such as reduced error rates.",2024-03-27,2024-06-25,Completed,EMP-103,12,5682,3,4,2.6,Low,1,Linux; Rust; C#; Flask; PyTorch; HTML
PROJ-793,Catalyst AI Pro,"Pioneer a next-generation data analytics framework for the real estate industry to increase market competitiveness. Using continuous delivery pipeline techniques, the architecture provides computer vision integration, handles integration complexity, and improves business metrics including enhanced compliance status.",2024-02-25,2024-07-24,Not Started,EMP-100,6,4812,5,5,2.8,High,3,Machine Learning; Microservices; Data Analysis; Rust; Go
PROJ-794,Momentum System Enterprise,"Establish a scalable reporting system platform serving retail operations organizations to drive innovation initiatives. Utilizing functional programming paradigm methodology, this project introduces predictive analytics capabilities while overcoming quality assurance processes and demonstrating success through reduced error rates.",2024-03-24,2024-08-21,On Hold,EMP-102,5,4509,5,4,4.1,Low,1,Pandas; Bash; HTML; Redis
PROJ-795,Acceleration System Core,"Engineer an innovative mobile application targeting media entertainment clients with the primary goal to optimize supply chain. Built on infrastructure as code principles, the solution incorporates voice-enabled interactions and navigates cross-team coordination to deliver measurable outcomes including reduced maintenance overhead.",2024-01-02,2024-09-28,In Progress,EMP-105,6,5283,9,8,3.9,High,3,Spring; CI/CD; Communication; Microservices; Rust; Django
PROJ-796,Horizon Digital Max,"Institute an enterprise-grade software solution for the education technology market focused on optimize supply chain. Employing API-first methodology strategy, the implementation features mobile-optimized design, manages legacy system integration, and targets key performance indicators such as improved team productivity.",2024-03-05,2025-01-29,In Progress,EMP-114,10,5007,11,9,2.1,High,3,Go; PyTorch; HTML; Flask; C++
PROJ-797,Momentum Automation Premium,"Design an intelligent digital platform ecosystem serving retail operations needs to expand service offerings. Through microservices architecture implementation, the platform offers federated learning system, resolves team skill development, and enhances operational efficiency via better decision support.",2024-02-28,2024-09-25,On Hold,EMP-105,10,5520,7,7,2.8,Medium,2,AWS; Microservices; Docker; CI/CD; Vue.js; Flask; C#; Git
PROJ-798,Synergy AI Next,"Construct a robust IoT ecosystem infrastructure for travel hospitality applications to modernize legacy infrastructure. Following responsive design system best practices, the system includes blockchain verification, addresses integration complexity, and optimizes for outcomes like faster time-to-market.",2024-01-19,2024-05-18,In Progress,EMP-105,6,7344,4,4,3.3,Medium,2,Django; HTML; Angular; JavaScript
PROJ-799,Horizon Integration X,"Create a robust compliance tool infrastructure for pharmaceutical applications to optimize supply chain. Following test-driven development best practices, the system includes responsive user interface, addresses disaster recovery planning, and optimizes for outcomes like faster time-to-market.",2024-02-19,2024-12-15,Not Started,EMP-115,8,7281,10,9,2.9,High,3,HTML; Java; CSS; AWS; Problem Solving; Django; Microservices; Spring
PROJ-800,Nexus Intelligence Unlimited,"Institute a comprehensive integration hub for the automotive industry sector designed to enhance scalability capabilities. Leveraging machine learning pipelines, this initiative will deliver augmented reality features while addressing performance optimization, ultimately achieving higher system availability.",2024-01-18,2024-07-16,In Progress,EMP-102,2,6939,6,7,4.0,Medium,2,Tableau; Pandas; Node.js; Spring; Ruby; Express.js; R; Leadership
PROJ-801,Genesis Enterprise Max,"Build a next-generation API framework framework for the e-commerce industry to modernize legacy infrastructure. Using machine learning pipelines techniques, the architecture provides mobile-optimized design, handles legacy system integration, and improves business metrics including better user engagement.",2024-03-13,2024-10-09,Completed,EMP-119,3,4524,7,7,3.8,Medium,2,CSS; TensorFlow; PHP; Leadership; Kubernetes
PROJ-802,Nexus Intelligence 360,"Construct a robust machine learning model infrastructure for media entertainment applications to expand service offerings. Following machine learning pipelines best practices, the system includes edge computing capabilities, addresses scalability challenges, and optimizes for outcomes like better data accuracy.",2024-03-09,2024-08-06,Not Started,EMP-101,12,7779,5,6,3.2,High,3,Django; R; Go; Ruby; HTML; Python; Machine Learning; Express.js
PROJ-803,Vertex AI Enterprise,"Build a scalable compliance tool platform serving agricultural technology organizations to reduce operational costs. Utilizing agile development practices methodology, this project introduces comprehensive reporting suite while overcoming disaster recovery planning and demonstrating success through higher system availability.",2024-03-04,2025-01-28,Not Started,EMP-111,4,5568,11,10,2.8,Low,1,Pandas; HTML; Swift; Python; Bash; Go; MySQL
PROJ-804,Catalyst Automation X,"Construct a scalable reporting system platform serving real estate organizations to enable real-time insights. Utilizing zero-trust security model methodology, this project introduces computer vision integration while overcoming cross-team coordination and demonstrating success through enhanced compliance status.",2024-03-16,2024-09-12,On Hold,EMP-109,10,3915,6,7,3.4,Low,1,PyTorch; Java; Communication; React; Rust; Ruby
PROJ-805,Transformation Cloud Pro,"Build a robust data analytics infrastructure for insurance applications to improve user experience. Following agile development practices best practices, the system includes comprehensive reporting suite, addresses integration complexity, and optimizes for outcomes like reduced operational costs.",2024-03-09,2024-10-05,Not Started,EMP-111,5,3714,7,6,4.8,Medium,2,Machine Learning; AWS; Jenkins; C#
PROJ-806,Quantum Intelligence Enterprise,"Construct a comprehensive software solution for the travel hospitality sector designed to accelerate decision-making processes. Leveraging serverless computing framework, this initiative will deliver real-time analytics dashboard while addressing change management, ultimately achieving improved system performance.",2024-03-12,2024-07-10,In Progress,EMP-119,5,2895,4,3,4.4,Low,1,Machine Learning; Git; Project Management; MySQL; NumPy; Leadership
PROJ-807,Catalyst Integration Premium,"Establish a scalable integration hub platform serving pharmaceutical organizations to reduce operational costs. Utilizing functional programming paradigm methodology, this project introduces intuitive user experience while overcoming integration complexity and demonstrating success through increased processing speed.",2024-02-22,2025-01-17,In Progress,EMP-114,2,10374,11,10,3.5,High,3,Communication; PHP; Git; Rust; CSS; Java; Docker; Django
PROJ-808,Acceleration Modernization Premium,"Institute an innovative digital platform targeting cybersecurity clients with the primary goal to enhance customer engagement. Built on functional programming paradigm principles, the solution incorporates responsive user interface and navigates security vulnerability mitigation to deliver measurable outcomes including better resource utilization.",2024-01-28,2024-08-25,Not Started,EMP-119,12,2598,7,5,3.8,Medium,2,Python; Express.js; GraphQL; Rust; Project Management
PROJ-809,Revolution System Core,"Pioneer an intelligent AI-powered tool ecosystem serving cybersecurity needs to improve data security measures. Through data mesh architecture implementation, the platform offers AI-assisted functionality, resolves technology stack modernization, and enhances operational efficiency via reduced error rates.",2024-03-07,2024-08-04,In Progress,EMP-100,4,3528,5,6,4.3,High,3,Leadership; Go; Agile; AWS
PROJ-810,Acceleration Framework Enterprise,"Roll out a comprehensive mobile application for the education technology sector designed to enhance scalability capabilities. Leveraging agile development practices, this initiative will deliver voice-enabled interactions while addressing regulatory compliance requirements, ultimately achieving improved scalability.",2024-01-05,2025-02-28,Completed,EMP-115,12,6909,14,10,4.7,High,3,Communication; NumPy; Ruby; Java; Azure; TensorFlow; Tableau
PROJ-811,Momentum Data Ultimate,"Introduce a cutting-edge reporting system solution in the gaming domain aimed at optimize supply chain. Based on reactive programming framework, this endeavor delivers voice-enabled interactions, mitigates quality assurance processes, and drives business value through improved security posture.",2024-03-07,2024-12-02,On Hold,EMP-104,3,4929,9,7,4.3,Medium,2,NumPy; Scrum; Redis; React; REST API; SQL; Flask
PROJ-812,Innovation Data Plus,"Formulate a next-generation progressive web app framework for the e-commerce industry to enhance scalability capabilities. Using microservices architecture techniques, the architecture provides computer vision integration, handles data migration complexities, and improves business metrics including enhanced compliance status.",2024-02-10,2025-02-04,Not Started,EMP-117,2,7035,12,8,3.4,High,3,PyTorch; Rust; Docker; GraphQL; Jenkins; Python
PROJ-813,Summit Analytics Advanced,"Establish a comprehensive enterprise system for the retail operations sector designed to improve product quality. Leveraging machine learning pipelines, this initiative will deliver distributed ledger technology while addressing aggressive timeline constraints, ultimately achieving enhanced compliance status.",2024-01-24,2024-08-21,Completed,EMP-115,3,4893,7,5,3.5,Medium,2,CSS; Spring; HTML; C++
PROJ-814,Evolution Program Next,"Construct a comprehensive software solution for the agricultural technology sector designed to drive innovation initiatives. Leveraging reactive programming, this initiative will deliver scalable infrastructure while addressing change management, ultimately achieving improved scalability.",2024-01-14,2024-11-09,Completed,EMP-107,2,7938,10,10,4.3,High,3,Linux; NumPy; Problem Solving; SQL
PROJ-815,Summit Platform Next,"Build an intelligent AI-powered tool ecosystem serving pharmaceutical needs to increase market competitiveness. Through machine learning pipelines implementation, the platform offers federated learning system, resolves legacy system integration, and enhances operational efficiency via enhanced user satisfaction.",2024-03-08,2024-08-05,Completed,EMP-111,8,1809,5,5,2.1,Low,1,TensorFlow; Redis; Swift; REST API
PROJ-816,Odyssey Data Advanced,"Launch an enterprise-grade progressive web app for the education technology market focused on facilitate global expansion. Employing zero-trust security model strategy, the implementation features automated workflow engine, manages cross-team coordination, and targets key performance indicators such as better data accuracy.",2024-03-08,2024-11-03,Completed,EMP-115,4,3204,8,7,3.2,Medium,2,REST API; PyTorch; Project Management; Problem Solving; AWS; Angular
PROJ-817,Nexus Integration Elite,"Formulate a cutting-edge digital platform solution in the agricultural technology domain aimed at enable real-time insights. Based on zero-trust security model framework, this endeavor delivers mobile-optimized design, mitigates budget allocation limitations, and drives business value through improved team productivity.",2024-02-23,2024-09-20,In Progress,EMP-116,12,5793,7,7,2.3,Medium,2,Django; Express.js; Go; Project Management; Ruby; Python; NumPy
